lead_id,lead_type,contact_surface,url,intended_use,status,probe_status,http_status,content_type,error,head_error
kaggle_stock_regime_owner_discussion_intraday_extension,source_label_owner_extension,Kaggle stock-regime dataset discussion/comments route,https://www.kaggle.com/datasets/mafaqbhatti/stock-market-regimes-20002026/discussion,Ask the existing source-label owner whether native 1m/5m/15m/30m/1h/4h regime-label exports exist or can be approved.,ready_public_surface_no_rows_acquired,ok_get_fallback,200,text/html; charset=utf-8,,
kaggle_stock_regime_owner_profile_intraday_extension,source_label_owner_identity_route,Kaggle owner profile for the source-label dataset,https://www.kaggle.com/mafaqbhatti,Owner identity route for the R3 native sub-hour source-label request.,ready_public_surface_no_rows_acquired,ok_get_fallback,200,text/html; charset=utf-8,,
yahoo_finance_help_surface,provider_terms_contact_route,Yahoo Finance help surface,https://help.yahoo.com/kb/finance-for-web,Clarify source provenance/licensing for yfinance-visible intraday panels; not accepted as regime labels by itself.,provider_data_surface_not_label_rows,ok,200,text/html;charset=utf-8,,
yahoo_terms_surface,provider_terms_contact_route,Yahoo terms/legal surface,https://legal.yahoo.com/us/en/yahoo/terms/otos/index.html,Terms/provenance route for Yahoo-origin intraday data; cannot close R3 without source-native labels.,provider_terms_surface_not_label_rows,ok,200,text/html; charset=UTF-8,,
nasdaq_data_link_contact,market_data_vendor_contact_route,Nasdaq Data Link contact/support route,https://data.nasdaq.com/contact,Potential route for index/ETF/futures intraday labeled data licensing or source-native regime-label availability.,public_contact_surface_no_rows_acquired,blocked_or_error,,,HTTPError: HTTP Error 404: Not Found,HTTPError: HTTP Error 404: Not Found
nasdaq_indexes_contact,index_owner_contact_route,Nasdaq indexes contact route,https://indexes.nasdaq.com/contactus,Ask for index-family intraday source/equivalence approval; not a label source unless source-native labels are provided.,public_contact_surface_no_rows_acquired,ok,200,text/html; charset=utf-8,,
cme_market_data_contacts,futures_market_data_contact_route,CME Group tools/contact list,https://www.cmegroup.com/tools-information/contacts-list.html,Potential route for CL/ES/NQ intraday futures source data and any source-native label or provenance approval.,public_contact_surface_no_rows_acquired,blocked_or_error,,,HTTPError: HTTP Error 403: Forbidden,HTTPError: HTTP Error 403: Forbidden
cboe_contact,exchange_contact_route,Cboe contact route,https://www.cboe.com/contact/,Potential route for exchange-native intraday context; cannot close R3 without owner-approved regime-label rows.,public_contact_surface_no_rows_acquired,ok,200,text/html; charset=utf-8,,
polygon_contact,market_data_vendor_contact_route,Polygon.io contact route,https://polygon.io/contact,Potential market-data licensing route for intraday panels; not accepted as source-native regime labels by itself.,vendor_data_surface_not_label_rows,ok,200,text/html; charset=utf-8,,
