source_id,url,route_type,readback,unlock_status
ssrn_detecting_layering_and_spoofing,https://papers.ssrn.com/sol3/papers.cfm?abstract_id=2835067,academic_methodology,Uses proprietary user-level identified order-book data/matched samples in the paper context; no public verifier-native positive/control/provenance export found,blocked_no_public_owner_export_rows
uts_detecting_layering_and_spoofing_pdf,https://opus.lib.uts.edu.au/handle/10453/117423,academic_repository,Repository/paper route for detecting layering/spoofing; points to research method/data context rather than an approved row package for this gate,blocked_no_source_control_package
weakly_supervised_lob_detection,https://arxiv.org/abs/2301.06008,academic_methodology,Weakly supervised order-book anomaly/labelling methodology; not owner-approved exchange/FINRA/CAT-like positive plus matched-normal control rows,blocked_methodology_not_source_rows
lobflow_package,https://pypi.org/project/lobflow/,simulated_or_synthetic_package,Realistic order-book flow generator/test-data route; simulated data cannot satisfy source-owned R6/R5/R3 control evidence,blocked_simulated_not_owner_export
cat_nms_plan,https://catnmsplan.com/,official_plan_context,Official CAT NMS plan context; public route did not expose downloadable spoofing/layering positives with matched normal controls or approval package,blocked_no_public_control_export
finra_public_search,https://www.finra.org/,official_context,FINRA public route checked for spoofing/layering order-lifecycle csv/control evidence; no verifier-native public package acquired,blocked_no_public_control_export
