lead_id,package_id,contact_surface,url,intended_use,status,probe_status,http_status,content_type,error,head_error
kaggle_stock_regime_owner_discussion,price_root_equivalence_us_index_futures,Kaggle stock-regime dataset discussion/comments route,https://www.kaggle.com/datasets/mafaqbhatti/stock-market-regimes-20002026/discussion,Request owner-approved equivalence policy or source-native rows for QQQ/NQ/NDX/futures extensions.,ready_public_surface_no_rows_acquired,ok_get_fallback,200,text/html; charset=utf-8,,
kaggle_stock_regime_owner_profile,price_root_equivalence_us_index_futures,Kaggle owner profile for stock-market-regimes source labels,https://www.kaggle.com/mafaqbhatti,Owner identity route for the R2 source-label equivalence request.,ready_public_surface_no_rows_acquired,ok_get_fallback,200,text/html; charset=utf-8,,
nasdaq_indexes_contact,price_root_equivalence_us_index_futures,Nasdaq indexes contact page,https://indexes.nasdaq.com/contactus,Ask whether Nasdaq-100/NDX equivalence policy or source-native index label documentation can be approved for QQQ/NQ/NDX use.,public_contact_surface_no_rows_acquired,ok,200,text/html; charset=utf-8,,
nasdaq_global_indexes_licensing,price_root_equivalence_us_index_futures,Nasdaq global indexes licensing and ETPs page,https://www.nasdaq.com/solutions/global-indexes/licensing-and-etps,"Index licensing route for explicit crosswalk/equivalence approval, not a label source by itself.",public_licensing_surface_no_rows_acquired,ok,200,text/html; charset=UTF-8,,
sp_dji_contact,price_root_equivalence_us_index_futures,S&P Dow Jones Indices contact page,https://www.spglobal.com/spdji/en/contact-us/,Potential route for S&P/Dow Jones index family source/equivalence approval; WAF may block unauthenticated probes.,public_contact_surface_no_rows_acquired,blocked_or_error,,,HTTPError: HTTP Error 403: Forbidden,HTTPError: HTTP Error 403: Forbidden
cme_market_data_contacts,price_root_equivalence_us_index_futures,CME Group tools/contact list,https://www.cmegroup.com/tools-information/contacts-list.html,Potential route for ES/NQ/MNQ futures market-data licensing or source equivalence policy.,public_contact_surface_no_rows_acquired,blocked_or_error,,,HTTPError: HTTP Error 403: Forbidden,HTTPError: HTTP Error 403: Forbidden
kraken_public_api_examples,price_root_equivalence_crypto,Kraken public API examples/support page,https://support.kraken.com/hc/articles/360000919986-Public-endpoint-examples-you-can-try-them-directly-in-a-web-browser-,Venue/public-data route for crypto source provenance; not accepted as regime labels without owner-approved labels.,venue_data_surface_not_label_rows,ok,200,text/html; charset=utf-8,,
kraken_futures_market_history_docs,price_root_equivalence_crypto,Kraken futures market-history API docs,https://docs.kraken.com/api/docs/futures-api/history/market-history/,"Venue-native crypto market-history route; can support provenance only, not MainRegimeV2 labels by itself.",venue_data_surface_not_label_rows,ok,200,text/html,,
cme_fx_rates_commodities_contacts,price_root_equivalence_fx_rates_commodities,CME Group tools/contact list for FX/rates/commodities futures,https://www.cmegroup.com/tools-information/contacts-list.html,Potential route for GC/CL/ZN or FX/rates/commodities futures data/equivalence policy.,public_contact_surface_no_rows_acquired,blocked_or_error,,,HTTPError: HTTP Error 403: Forbidden,HTTPError: HTTP Error 403: Forbidden
