source,id,note,title,status,reason
kaggle,adamatractor/institutional-crypto-l2-orderbook-30lvl-1m-5m,recent_crypto_l2_orderbook_control_candidate,24 Crypto - Order book - 30 lvl,blocked_positive_or_topic_only_no_matched_negatives,"Metadata has manipulation-like topic or positive labels, but no matched negative/control-row evidence."
kaggle,praanj/limit-orderbook-data,legacy_lob_control_candidate,Limit Orderbook data,control_only_not_direct_positive_source,Metadata has L2/order-lifecycle or orderbook rows but no direct positive manipulation labels.
kaggle,a53e93e57a1/maker-order-dataset-osaka-20210301,order_lifecycle_control_candidate,Maker Order Events in Osaka Exchange,control_only_not_direct_positive_source,Metadata has L2/order-lifecycle or orderbook rows but no direct positive manipulation labels.
huggingface,Go3x3/pump_and_dump_dataset,social_text_pump_dump_candidate,pump_and_dump_dataset,blocked_positive_or_topic_only_no_matched_negatives,"HF metadata exposes pump/dump package files, but README has no schema detail and metadata does not show matched negative/control rows."
zenodo,18667008,spoofing_preprint_no_data_files,High-Frequency Market Microstructure Analysis using Transformer-Encoder Networks (TEN) and Graph Neural Networks (GNN) for Detecting Algorithmic Spoofing,blocked_preprint_only_no_rows,"Zenodo record is a preprint/PDF record, not a row dataset with positive and matched negative controls."
