provider,provider_id,symbol,timeframe,provider_requested,provider_data_acquired,aq_provider_invoked,data_path,evidence_status,provider_status_reason
IBKR,ibkr_bridge,SPY,1h,true,true,false,docs/experiments/actionable-regime-confidence/runs/20260512T143900+0800-codex-provider-backed-regime-validation-smoke-v1/data/ibkr_spy_1h_5y.normalized.csv,provider_backed_source_file_available_from_143900,local IBKR file consumed; live bridge currently dependency-unhealthy in provider-status
TradingViewRemix/TVR,tradingview_remix,SPY_or_BTCUSDT,1h,true,false,false,,fail_closed_no_current_tvr_data_file_for_this_seed,143900/145809 did not include TVR; 144208 recorded TVRemix rate-limit readback
yfinance/YF,yfinance,ES,1h,true,true,false,docs/experiments/actionable-regime-confidence/runs/20260512T143900+0800-codex-provider-backed-regime-validation-smoke-v1/data/yahoo_es_1h_20240513_20260512.normalized.csv,provider_backed_source_file_available_from_143900,provider-status reports yfinance ready
Kraken,kraken_cli,XBTUSD_or_ETHUSD,1h,true,false,false,,fail_closed_no_current_kraken_ohlcv_file_for_this_seed,provider-status reports kraken_cli ready but no 143900/145809 data file was acquired
Binance,binance_public,BTCUSDT,1h,true,true,false,docs/experiments/actionable-regime-confidence/runs/20260512T143900+0800-codex-provider-backed-regime-validation-smoke-v1/data/binance_btcusdt_1h_20170817_20260512.normalized.csv,provider_backed_source_file_available_from_143900,source file exists; provider-status says system-python adapter deps missing for live fetch
Bybit,bybit_public,BTCUSDT_or_ETHUSDT,1h,true,false,false,,fail_closed_no_current_bybit_data_file_for_this_seed,provider-status has no acquired Bybit file for this seed
