owner_file,owner_field,verifier_file,verifier_field,mapping_rule
direct_manipulation_positive_rows.csv,positive_label,positive_spoofing_layering_rows.csv,label,must equal or map to positive_spoofing_layering under current verifier; other species need explicit contract/adaptor approval
direct_manipulation_positive_rows.csv,event_start,positive_spoofing_layering_rows.csv,earliest_order_received_time,timestamp with timezone
direct_manipulation_positive_rows.csv,event_end,positive_spoofing_layering_rows.csv,latest_order_received_time,timestamp with timezone
direct_manipulation_positive_rows.csv,matched_control_group_id,positive_spoofing_layering_rows.csv,matched_negative_group_id,join key must also exist in matched_negative_normal_activity_rows.csv
direct_manipulation_matched_controls.csv,matched_control_group_id,matched_negative_normal_activity_rows.csv,matched_negative_group_id,same join key as positives
direct_manipulation_provenance.json,owner_approval_reference,provenance_manifest.json,owner_approval_reference,must cite source owner/export approval or source-owned report basis
direct_manipulation_provenance.json,split_contract,provenance_manifest.json,split_contract,exact split by default; market-family/venue-family only with explicit owner approval
