provider,provider_id,ready,status,reason,summary
yfinance,yfinance,True,ready,native_yfinance_runtime_available,Zero-config live runtime backed by yfinance-compatible fetches for observation and replay-adjacent workflows.
tradingview_mcp,tradingview_mcp,True,ready,mcp_url_and_api_key_available,"Hot-pluggable TradingView MCP path: zero-config local stdio for OHLCV, optional remote key for enriched lanes."
ibkr,ibkr,False,configured_runtime_unhealthy,ibkr_runtime_dependencies_missing_with_gateway_reachable,Setup-required IBKR market-data path for broker-linked futures and equities workflows.
kraken_public,kraken_public,False,configured_runtime_unhealthy,python3_provider_dependencies_missing,"Public no-login crypto, forex, and tokenized-asset data path; later wallet/runtime flows use kraken_cli separately."
kraken_cli,kraken_cli,True,ready,kraken_cli_config_detected,Credentialed local Kraken CLI/runtime path for wallet or execution-adjacent flows.
ibkr_bridge,ibkr_bridge,False,configured_runtime_unhealthy,ibkr_bridge_runtime_dependencies_missing_with_gateway_reachable,Local IBKR bridge reused by broker-linked workflows after the user enables the local API.
