source_row_id,trade_date,symbol,materializable,semantic_duplicate,snippet_hits_json,screen_status
cftc_jpm_20111212_trader1_silver_buy_layered_spoof,2011-12-12,"Silver Futures contract, March 2012 expiry",True,False,"{""at 11:59:39:168 a.m., Trader 1 began"": true, ""his five-lot Genuine Order to sell was fully filled"": true, ""on December 12, 2011, at 11:59:36.669, Trader 1 placed a"": true}",control_complete_candidate
cftc_jpm_20131210_trader5_silver_buy_spoof,2013-12-10,"Silver Futures contract, March 2014 expiry",True,False,"{""On December 10, 2013, at 1:59:22.386 a.m."": true, ""Trader 5 canceled his buy-side Spoof Order"": true, ""at 1:59:26.901 a.m., Trader 5 entered a Spoof Order for 100 lots"": true}",control_complete_candidate
cftc_jpm_20140305_trader6_silver_buy_layered_spoof,2014-03-05,"Silver Futures contract, May 2014 expiry",True,False,"{""On March 5, 2014, at 8:18:39.699 a.m."": true, ""Trader 6 began entering a series of Layered"": true, ""his two-lot Genuine Order to sell was fully filled"": true}",control_complete_candidate
cftc_jpm_20160622_trader4_platinum_buy_layered_spoof,2016-06-22,"Platinum Futures contract, July 2016 expiry",True,False,"{""Beginning at 2:14:37.407"": true, ""On June 22, 2016, at 2:14:33.935 a.m."": true, ""eight Layered Spoof Orders on the buy"": true}",control_complete_candidate
cftc_jpm_20090720_trader7_tbond_buy_layered_spoof,2009-07-20,"T-Bond Futures contract, September 2009 expiry",True,False,"{""On July 20, 2009, at 7:47:13.597 a.m."": true, ""his 100-lot Genuine"": true, ""six Layered Spoof Orders on the buy side of the market totaling 1,800"": true}",control_complete_candidate
cftc_jpm_20100204_trader8_tnote_sell_spoof,2010-02-04,"10-Year T-Note Futures contract, March 2010 expiry",True,False,"{""On February 4, 2010, at 1:27:27.279 p.m."": true, ""Trader 8 canceled his sell-"": true, ""Trader 8 entered a Spoof Order for 1,000 lots on the sell side"": true}",control_complete_candidate
cftc_jpm_20110927_trader9_tnote_sell_spoof,2011-09-27,"10-Year T-Note Futures contract, December 2011 expiry",True,False,"{""On September 27, 2011, at 2:03:54.204 p.m."": true, ""Spoof Order for 3,000 lots"": true, ""Trader 9 entered"": true}",control_complete_candidate
cftc_jpm_20150630_trader10_ultra_tbond_sell_spoof,2015-06-30,"Ultra T-Bond Futures contract, September 2015 expiry",True,False,"{""On June 30, 2015, at 8:45:46.627 a.m."": true, ""Trader 10 entered a Spoof Order for 100 lots on the sell side"": true, ""at 8:46:04.418 a.m."": true}",control_complete_candidate
