requirement,evidence,status,notes
Named Board B markdown is the live contract,docs/plans/2026-05-10-regime-conditional-auto-quant-profitability-todo.md,pass,Board B was read directly before this audit.
Regime-rooted branch path is preserved,Board B 074535 selection-gate audit and current cursor,partial_fail_closed,"Branch path is visible, but path-ranker validation and execution remain fail-closed."
Do not run selected-data AutoQuant without explicit HTF/MTF/LTF selection,docs/experiments/actionable-regime-confidence/runs/20260512T074535+0800-codex-board-b-current-objective-audit-selection-gate-v1/checks/board_b_current_objective_audit_selection_gate_v1_assertions.out,pass_fail_closed,075535 says next gate is exactly one user-selected HTF/MTF/LTF path.
Source/control unlock exists before canonical merge or promotion,docs/experiments/actionable-regime-confidence/runs/20260512T075009+0800-codex-source-control-arrival-poll-after-074700-v1/checks/source_control_arrival_poll_after_074700_v1_assertions.out,blocked,075009 reports no new R3/R5/R6 required root.
Raw Databento OHLCV is not promoted as labels or controls,docs/experiments/actionable-regime-confidence/runs/20260512T074844+0800-codex-databento-gc-raw-recency-disposition-after-074424-v1/checks/databento_gc_raw_recency_disposition_after_074424_v1_assertions.out,pass_fail_closed,"Post-cutoff raw OHLCV exists, but no source-label or order-lifecycle columns exist."
Provider/runtime surfaces are refreshed with real commands,docs/experiments/actionable-regime-confidence/runs/20260512T075108+0800-codex-board-b-readonly-provider-runtime-gate-refresh-v1/readonly_provider_runtime_gate_refresh_v1.md,partial_non_promoting,"Commands ran, but AutoQuant data is missing and workflow remains user-selected-history blocked."
Filter / Pre-Bayes / BBN / CatBoost / execution-tree chain promotes only after gates,075108 workflow/pre-bayes/path-ranking read-only outputs,blocked,Read-only chain state exists; it is not a selected-data rerun or promotion.
No update_goal until objective is complete,"074535, 074844, and 075009 assertions",pass_fail_closed,Objective remains incomplete.
